{"individuo":{"id":"0239skdlfj2029"},"datadeNascimento":"Nov 18, 2018 2:09:15 PM","nascimentoAcuracia":"Nov 18, 2018 2:09:15 PM","nascimentoSegmento":{"codigo":"100","descricao":"descricao"},"nascimentoPluralidade":{"codigo":100,"descricao":"descricao"},"nascimentoOrdem":{"codigo":100,"descricao":"descricao"},"obito":"Nov 18, 2018 2:09:15 PM","obitoAcuracia":"Obito Acurácia","obitoFonte":{"codigo":100,"descricao":"descricao"},"sexo":{"codigo":100,"alternativo":"alternativa","descricao":"descricao"},"mae":"Mãe","pai":"Pai","situacaoFamiliar":{"codigo":100,"descricao":"descricao"},"raca":{"codigo":100,"descricao":"descricao"},"comentario":"comentário","nacionalidade":{"codigo":100,"descricao":"descricao"},"municipio":{"codigo":"3571","estado":"Goiás","municipio":"Goiânia"},"estado":{"codigo":"562","nome":"Goiás"},"pais":{"codigo":500,"nome":"Brasil"},"dataDeEntradaPais":"Nov 18, 2018 2:09:15 PM"}